{
  "schemaVersion": 2,
  "jurisdictionCode": "HN",
  "generatedAt": "2026-10-20T19:54:39Z",
  "sources": [
    {
      "id": "hn-wikidata-q16146159",
      "name": "Wikidata: Nasry Asfura",
      "url": "https://www.wikidata.org/wiki/Q16146159",
      "sourceType": "wikidata",
      "publisher": "Wikidata",
      "language": "en",
      "license": "CC0-1.0",
      "retrievedAt": "2026-10-20T19:54:39Z",
      "archivedUrl": null,
      "notes": "P35 on Honduras (Q783), rank ontology#preferred, start 2026-01-27"
    }
  ],
  "officeholders": [
    {
      "id": "hn-head-of-state-1",
      "jurisdictionCode": "HN",
      "subdivisionCode": null,
      "administrativeArea": null,
      "office": {
        "id": "Q13341442",
        "title": "President of Honduras",
        "localTitle": null,
        "level": "national",
        "selectionMethod": "unknown",
        "termStart": "2026-01-27",
        "termEnd": null
      },
      "person": {
        "name": "Nasry Asfura",
        "localName": null,
        "languageCodes": []
      },
      "contacts": [],
      "sourceIds": [
        "hn-wikidata-q16146159"
      ],
      "verification": {
        "status": "unverified",
        "checkedAt": "2026-10-20T19:54:39Z",
        "verifiedAt": null,
        "verifiedBy": null,
        "method": null,
        "evidenceSourceIds": [
          "hn-wikidata-q16146159"
        ],
        "reviewBy": null,
        "notes": "From Wikidata. Needs an official government or parliament page and a second-person check before it can be verified."
      }
    }
  ]
}
