{
  "schemaVersion": 2,
  "jurisdictionCode": "US",
  "generatedAt": "2026-10-20T19:54:39Z",
  "sources": [
    {
      "id": "us-wikidata-q22686",
      "name": "Wikidata: Donald Trump",
      "url": "https://www.wikidata.org/wiki/Q22686",
      "sourceType": "wikidata",
      "publisher": "Wikidata",
      "language": "en",
      "license": "CC0-1.0",
      "retrievedAt": "2026-10-20T19:54:39Z",
      "archivedUrl": null,
      "notes": "P35 on United States (Q30), rank ontology#normal, start 2025-01-20"
    }
  ],
  "officeholders": [
    {
      "id": "us-head-of-state-1",
      "jurisdictionCode": "US",
      "subdivisionCode": null,
      "administrativeArea": null,
      "office": {
        "id": "Q11696",
        "title": "President of the United States",
        "localTitle": null,
        "level": "national",
        "selectionMethod": "unknown",
        "termStart": "2025-01-20",
        "termEnd": null
      },
      "person": {
        "name": "Donald Trump",
        "localName": null,
        "languageCodes": []
      },
      "contacts": [],
      "sourceIds": [
        "us-wikidata-q22686"
      ],
      "verification": {
        "status": "unverified",
        "checkedAt": "2026-10-20T19:54:39Z",
        "verifiedAt": null,
        "verifiedBy": null,
        "method": null,
        "evidenceSourceIds": [
          "us-wikidata-q22686"
        ],
        "reviewBy": null,
        "notes": "From Wikidata. Needs an official government or parliament page and a second-person check before it can be verified."
      }
    }
  ]
}
