{
  "schemaVersion": 2,
  "jurisdictionCode": "TW",
  "generatedAt": "2026-10-20T19:54:39Z",
  "sources": [
    {
      "id": "tw-wikidata-q3847080",
      "name": "Wikidata: Lai Ching-te",
      "url": "https://www.wikidata.org/wiki/Q3847080",
      "sourceType": "wikidata",
      "publisher": "Wikidata",
      "language": "en",
      "license": "CC0-1.0",
      "retrievedAt": "2026-10-20T19:54:39Z",
      "archivedUrl": null,
      "notes": "P35 on Taiwan (Q865), rank ontology#preferred, start 2024-05-20"
    },
    {
      "id": "tw-wikidata-q5116472",
      "name": "Wikidata: Cho Jung-tai",
      "url": "https://www.wikidata.org/wiki/Q5116472",
      "sourceType": "wikidata",
      "publisher": "Wikidata",
      "language": "en",
      "license": "CC0-1.0",
      "retrievedAt": "2026-10-20T19:54:39Z",
      "archivedUrl": null,
      "notes": "P6 on Taiwan (Q865), rank ontology#preferred, start 2024-05-20"
    }
  ],
  "officeholders": [
    {
      "id": "tw-head-of-state-1",
      "jurisdictionCode": "TW",
      "subdivisionCode": null,
      "administrativeArea": null,
      "office": {
        "id": "Q887003",
        "title": "President of the Republic of China",
        "localTitle": null,
        "level": "national",
        "selectionMethod": "unknown",
        "termStart": "2024-05-20",
        "termEnd": null
      },
      "person": {
        "name": "Lai Ching-te",
        "localName": null,
        "languageCodes": []
      },
      "contacts": [],
      "sourceIds": [
        "tw-wikidata-q3847080"
      ],
      "verification": {
        "status": "unverified",
        "checkedAt": "2026-10-20T19:54:39Z",
        "verifiedAt": null,
        "verifiedBy": null,
        "method": null,
        "evidenceSourceIds": [
          "tw-wikidata-q3847080"
        ],
        "reviewBy": null,
        "notes": "From Wikidata. Needs an official government or parliament page and a second-person check before it can be verified."
      }
    },
    {
      "id": "tw-head-of-government-1",
      "jurisdictionCode": "TW",
      "subdivisionCode": null,
      "administrativeArea": null,
      "office": {
        "id": "Q702650",
        "title": "Premier of the Republic of China",
        "localTitle": null,
        "level": "national",
        "selectionMethod": "unknown",
        "termStart": "2024-05-20",
        "termEnd": null
      },
      "person": {
        "name": "Cho Jung-tai",
        "localName": null,
        "languageCodes": []
      },
      "contacts": [],
      "sourceIds": [
        "tw-wikidata-q5116472"
      ],
      "verification": {
        "status": "unverified",
        "checkedAt": "2026-10-20T19:54:39Z",
        "verifiedAt": null,
        "verifiedBy": null,
        "method": null,
        "evidenceSourceIds": [
          "tw-wikidata-q5116472"
        ],
        "reviewBy": null,
        "notes": "From Wikidata. Needs an official government or parliament page and a second-person check before it can be verified."
      }
    }
  ]
}
