{
  "schemaVersion": 2,
  "jurisdictionCode": "CW",
  "generatedAt": "2026-10-20T19:54:39Z",
  "sources": [
    {
      "id": "cw-wikidata-q154952",
      "name": "Wikidata: William Alexander of the Netherlands",
      "url": "https://www.wikidata.org/wiki/Q154952",
      "sourceType": "wikidata",
      "publisher": "Wikidata",
      "language": "en",
      "license": "CC0-1.0",
      "retrievedAt": "2026-10-20T19:54:39Z",
      "archivedUrl": null,
      "notes": "P35 on Curaçao (Q25279), rank ontology#normal"
    },
    {
      "id": "cw-wikidata-q29030093",
      "name": "Wikidata: Gilmar Pisas",
      "url": "https://www.wikidata.org/wiki/Q29030093",
      "sourceType": "wikidata",
      "publisher": "Wikidata",
      "language": "en",
      "license": "CC0-1.0",
      "retrievedAt": "2026-10-20T19:54:39Z",
      "archivedUrl": null,
      "notes": "P6 on Curaçao (Q25279), rank ontology#normal, start 2021-03-20"
    }
  ],
  "officeholders": [
    {
      "id": "cw-head-of-state-1",
      "jurisdictionCode": "CW",
      "subdivisionCode": null,
      "administrativeArea": null,
      "office": {
        "id": "Q2045066",
        "title": "King of the Netherlands",
        "localTitle": null,
        "level": "national",
        "selectionMethod": "unknown",
        "termStart": null,
        "termEnd": null
      },
      "person": {
        "name": "William Alexander of the Netherlands",
        "localName": null,
        "languageCodes": []
      },
      "contacts": [],
      "sourceIds": [
        "cw-wikidata-q154952"
      ],
      "verification": {
        "status": "unverified",
        "checkedAt": "2026-10-20T19:54:39Z",
        "verifiedAt": null,
        "verifiedBy": null,
        "method": null,
        "evidenceSourceIds": [
          "cw-wikidata-q154952"
        ],
        "reviewBy": null,
        "notes": "From Wikidata. Needs an official government or parliament page and a second-person check before it can be verified."
      }
    },
    {
      "id": "cw-head-of-government-1",
      "jurisdictionCode": "CW",
      "subdivisionCode": null,
      "administrativeArea": null,
      "office": {
        "id": "Q2247822",
        "title": "Prime Minister of Curaçao",
        "localTitle": null,
        "level": "national",
        "selectionMethod": "unknown",
        "termStart": "2021-03-20",
        "termEnd": null
      },
      "person": {
        "name": "Gilmar Pisas",
        "localName": null,
        "languageCodes": []
      },
      "contacts": [],
      "sourceIds": [
        "cw-wikidata-q29030093"
      ],
      "verification": {
        "status": "unverified",
        "checkedAt": "2026-10-20T19:54:39Z",
        "verifiedAt": null,
        "verifiedBy": null,
        "method": null,
        "evidenceSourceIds": [
          "cw-wikidata-q29030093"
        ],
        "reviewBy": null,
        "notes": "From Wikidata. Needs an official government or parliament page and a second-person check before it can be verified."
      }
    }
  ]
}
