{
  "schemaVersion": 2,
  "jurisdictionCode": "AZ",
  "generatedAt": "2026-10-20T19:54:39Z",
  "sources": [
    {
      "id": "az-wikidata-q57371",
      "name": "Wikidata: Ilham Aliyev",
      "url": "https://www.wikidata.org/wiki/Q57371",
      "sourceType": "wikidata",
      "publisher": "Wikidata",
      "language": "en",
      "license": "CC0-1.0",
      "retrievedAt": "2026-10-20T19:54:39Z",
      "archivedUrl": null,
      "notes": "P35 on Azerbaijan (Q227), rank ontology#normal, start 2003-10-31"
    },
    {
      "id": "az-wikidata-q12850075",
      "name": "Wikidata: Ali Asadov",
      "url": "https://www.wikidata.org/wiki/Q12850075",
      "sourceType": "wikidata",
      "publisher": "Wikidata",
      "language": "en",
      "license": "CC0-1.0",
      "retrievedAt": "2026-10-20T19:54:39Z",
      "archivedUrl": null,
      "notes": "P6 on Azerbaijan (Q227), rank ontology#normal, start 2018-10-08"
    }
  ],
  "officeholders": [
    {
      "id": "az-head-of-state-1",
      "jurisdictionCode": "AZ",
      "subdivisionCode": null,
      "administrativeArea": null,
      "office": {
        "id": "Q205602",
        "title": "President of Azerbaijan",
        "localTitle": null,
        "level": "national",
        "selectionMethod": "unknown",
        "termStart": "2003-10-31",
        "termEnd": null
      },
      "person": {
        "name": "Ilham Aliyev",
        "localName": null,
        "languageCodes": []
      },
      "contacts": [],
      "sourceIds": [
        "az-wikidata-q57371"
      ],
      "verification": {
        "status": "unverified",
        "checkedAt": "2026-10-20T19:54:39Z",
        "verifiedAt": null,
        "verifiedBy": null,
        "method": null,
        "evidenceSourceIds": [
          "az-wikidata-q57371"
        ],
        "reviewBy": null,
        "notes": "From Wikidata. Needs an official government or parliament page and a second-person check before it can be verified."
      }
    },
    {
      "id": "az-head-of-government-1",
      "jurisdictionCode": "AZ",
      "subdivisionCode": null,
      "administrativeArea": null,
      "office": {
        "id": "Q946064",
        "title": "Prime Minister of Azerbaijan",
        "localTitle": null,
        "level": "national",
        "selectionMethod": "unknown",
        "termStart": "2018-10-08",
        "termEnd": null
      },
      "person": {
        "name": "Ali Asadov",
        "localName": null,
        "languageCodes": []
      },
      "contacts": [],
      "sourceIds": [
        "az-wikidata-q12850075"
      ],
      "verification": {
        "status": "unverified",
        "checkedAt": "2026-10-20T19:54:39Z",
        "verifiedAt": null,
        "verifiedBy": null,
        "method": null,
        "evidenceSourceIds": [
          "az-wikidata-q12850075"
        ],
        "reviewBy": null,
        "notes": "From Wikidata. Needs an official government or parliament page and a second-person check before it can be verified."
      }
    }
  ]
}
