{
  "schemaVersion": 2,
  "jurisdictionCode": "TG",
  "generatedAt": "2026-10-20T19:54:39Z",
  "sources": [
    {
      "id": "tg-wikidata-q6169516",
      "name": "Wikidata: Jean-Lucien Savi de Tové",
      "url": "https://www.wikidata.org/wiki/Q6169516",
      "sourceType": "wikidata",
      "publisher": "Wikidata",
      "language": "en",
      "license": "CC0-1.0",
      "retrievedAt": "2026-10-20T19:54:39Z",
      "archivedUrl": null,
      "notes": "P35 on Togo (Q945), rank ontology#preferred, start 2025-05-03"
    },
    {
      "id": "tg-wikidata-q4414",
      "name": "Wikidata: Faure Essozimna Gnassingbé",
      "url": "https://www.wikidata.org/wiki/Q4414",
      "sourceType": "wikidata",
      "publisher": "Wikidata",
      "language": "en",
      "license": "CC0-1.0",
      "retrievedAt": "2026-10-20T19:54:39Z",
      "archivedUrl": null,
      "notes": "P6 on Togo (Q945), rank ontology#normal, start 2025-05-03"
    }
  ],
  "officeholders": [
    {
      "id": "tg-head-of-state-1",
      "jurisdictionCode": "TG",
      "subdivisionCode": null,
      "administrativeArea": null,
      "office": {
        "id": "Q28015471",
        "title": "President of Togo",
        "localTitle": null,
        "level": "national",
        "selectionMethod": "unknown",
        "termStart": "2025-05-03",
        "termEnd": null
      },
      "person": {
        "name": "Jean-Lucien Savi de Tové",
        "localName": null,
        "languageCodes": []
      },
      "contacts": [],
      "sourceIds": [
        "tg-wikidata-q6169516"
      ],
      "verification": {
        "status": "unverified",
        "checkedAt": "2026-10-20T19:54:39Z",
        "verifiedAt": null,
        "verifiedBy": null,
        "method": null,
        "evidenceSourceIds": [
          "tg-wikidata-q6169516"
        ],
        "reviewBy": null,
        "notes": "From Wikidata. Needs an official government or parliament page and a second-person check before it can be verified."
      }
    },
    {
      "id": "tg-head-of-government-1",
      "jurisdictionCode": "TG",
      "subdivisionCode": null,
      "administrativeArea": null,
      "office": {
        "id": "Q30100661",
        "title": "President of the Council of Ministers of Togo",
        "localTitle": null,
        "level": "national",
        "selectionMethod": "unknown",
        "termStart": "2025-05-03",
        "termEnd": null
      },
      "person": {
        "name": "Faure Essozimna Gnassingbé",
        "localName": null,
        "languageCodes": []
      },
      "contacts": [],
      "sourceIds": [
        "tg-wikidata-q4414"
      ],
      "verification": {
        "status": "unverified",
        "checkedAt": "2026-10-20T19:54:39Z",
        "verifiedAt": null,
        "verifiedBy": null,
        "method": null,
        "evidenceSourceIds": [
          "tg-wikidata-q4414"
        ],
        "reviewBy": null,
        "notes": "From Wikidata. Needs an official government or parliament page and a second-person check before it can be verified."
      }
    }
  ]
}
