{
  "schemaVersion": 2,
  "jurisdictionCode": "GE",
  "generatedAt": "2026-10-20T19:54:39Z",
  "sources": [
    {
      "id": "ge-wikidata-q711893",
      "name": "Wikidata: Mikheil Kavelashvili",
      "url": "https://www.wikidata.org/wiki/Q711893",
      "sourceType": "wikidata",
      "publisher": "Wikidata",
      "language": "en",
      "license": "CC0-1.0",
      "retrievedAt": "2026-10-20T19:54:39Z",
      "archivedUrl": null,
      "notes": "P35 on Georgia (Q230), rank ontology#preferred, start 2024-12-29"
    },
    {
      "id": "ge-wikidata-q27885302",
      "name": "Wikidata: Irakli Kobakhidze",
      "url": "https://www.wikidata.org/wiki/Q27885302",
      "sourceType": "wikidata",
      "publisher": "Wikidata",
      "language": "en",
      "license": "CC0-1.0",
      "retrievedAt": "2026-10-20T19:54:39Z",
      "archivedUrl": null,
      "notes": "P6 on Georgia (Q230), rank ontology#preferred, start 2024-02-08"
    }
  ],
  "officeholders": [
    {
      "id": "ge-head-of-state-1",
      "jurisdictionCode": "GE",
      "subdivisionCode": null,
      "administrativeArea": null,
      "office": {
        "id": "Q843405",
        "title": "President of Georgia",
        "localTitle": null,
        "level": "national",
        "selectionMethod": "unknown",
        "termStart": "2024-12-29",
        "termEnd": null
      },
      "person": {
        "name": "Mikheil Kavelashvili",
        "localName": null,
        "languageCodes": []
      },
      "contacts": [],
      "sourceIds": [
        "ge-wikidata-q711893"
      ],
      "verification": {
        "status": "unverified",
        "checkedAt": "2026-10-20T19:54:39Z",
        "verifiedAt": null,
        "verifiedBy": null,
        "method": null,
        "evidenceSourceIds": [
          "ge-wikidata-q711893"
        ],
        "reviewBy": null,
        "notes": "From Wikidata. Needs an official government or parliament page and a second-person check before it can be verified."
      }
    },
    {
      "id": "ge-head-of-government-1",
      "jurisdictionCode": "GE",
      "subdivisionCode": null,
      "administrativeArea": null,
      "office": {
        "id": "Q1975365",
        "title": "Prime Minister of Georgia",
        "localTitle": null,
        "level": "national",
        "selectionMethod": "unknown",
        "termStart": "2024-02-08",
        "termEnd": null
      },
      "person": {
        "name": "Irakli Kobakhidze",
        "localName": null,
        "languageCodes": []
      },
      "contacts": [],
      "sourceIds": [
        "ge-wikidata-q27885302"
      ],
      "verification": {
        "status": "unverified",
        "checkedAt": "2026-10-20T19:54:39Z",
        "verifiedAt": null,
        "verifiedBy": null,
        "method": null,
        "evidenceSourceIds": [
          "ge-wikidata-q27885302"
        ],
        "reviewBy": null,
        "notes": "From Wikidata. Needs an official government or parliament page and a second-person check before it can be verified."
      }
    }
  ]
}
