{
  "schemaVersion": 2,
  "jurisdictionCode": "GM",
  "generatedAt": "2026-10-20T19:54:39Z",
  "sources": [
    {
      "id": "gm-wikidata-q27917049",
      "name": "Wikidata: Adama Barrow",
      "url": "https://www.wikidata.org/wiki/Q27917049",
      "sourceType": "wikidata",
      "publisher": "Wikidata",
      "language": "en",
      "license": "CC0-1.0",
      "retrievedAt": "2026-10-20T19:54:39Z",
      "archivedUrl": null,
      "notes": "P35 on The Gambia (Q1005), rank ontology#preferred, start 2017-01-21"
    }
  ],
  "officeholders": [
    {
      "id": "gm-head-of-state-1",
      "jurisdictionCode": "GM",
      "subdivisionCode": null,
      "administrativeArea": null,
      "office": {
        "id": "Q15921518",
        "title": "President of the Gambia",
        "localTitle": null,
        "level": "national",
        "selectionMethod": "unknown",
        "termStart": "2017-01-21",
        "termEnd": null
      },
      "person": {
        "name": "Adama Barrow",
        "localName": null,
        "languageCodes": []
      },
      "contacts": [],
      "sourceIds": [
        "gm-wikidata-q27917049"
      ],
      "verification": {
        "status": "unverified",
        "checkedAt": "2026-10-20T19:54:39Z",
        "verifiedAt": null,
        "verifiedBy": null,
        "method": null,
        "evidenceSourceIds": [
          "gm-wikidata-q27917049"
        ],
        "reviewBy": null,
        "notes": "From Wikidata. Needs an official government or parliament page and a second-person check before it can be verified."
      }
    }
  ]
}
