{
  "schemaVersion": 2,
  "jurisdictionCode": "BO",
  "generatedAt": "2026-10-20T19:54:39Z",
  "sources": [
    {
      "id": "bo-wikidata-q110520817",
      "name": "Wikidata: Rodrigo Paz",
      "url": "https://www.wikidata.org/wiki/Q110520817",
      "sourceType": "wikidata",
      "publisher": "Wikidata",
      "language": "en",
      "license": "CC0-1.0",
      "retrievedAt": "2026-10-20T19:54:39Z",
      "archivedUrl": null,
      "notes": "P35 on Bolivia (Q750), rank ontology#preferred, start 2025-11-08"
    }
  ],
  "officeholders": [
    {
      "id": "bo-head-of-state-1",
      "jurisdictionCode": "BO",
      "subdivisionCode": null,
      "administrativeArea": null,
      "office": {
        "id": "Q373548",
        "title": "President of Bolivia",
        "localTitle": null,
        "level": "national",
        "selectionMethod": "unknown",
        "termStart": "2025-11-08",
        "termEnd": null
      },
      "person": {
        "name": "Rodrigo Paz",
        "localName": null,
        "languageCodes": []
      },
      "contacts": [],
      "sourceIds": [
        "bo-wikidata-q110520817"
      ],
      "verification": {
        "status": "unverified",
        "checkedAt": "2026-10-20T19:54:39Z",
        "verifiedAt": null,
        "verifiedBy": null,
        "method": null,
        "evidenceSourceIds": [
          "bo-wikidata-q110520817"
        ],
        "reviewBy": null,
        "notes": "From Wikidata. Needs an official government or parliament page and a second-person check before it can be verified."
      }
    }
  ]
}
