{
  "schemaVersion": 2,
  "jurisdictionCode": "GG",
  "generatedAt": "2026-10-20T19:54:39Z",
  "sources": [
    {
      "id": "gg-wikidata-q43274",
      "name": "Wikidata: Charles III",
      "url": "https://www.wikidata.org/wiki/Q43274",
      "sourceType": "wikidata",
      "publisher": "Wikidata",
      "language": "en",
      "license": "CC0-1.0",
      "retrievedAt": "2026-10-20T19:54:39Z",
      "archivedUrl": null,
      "notes": "P35 on Guernsey (Q25230), rank ontology#normal, start 2022-09-08"
    },
    {
      "id": "gg-wikidata-q135400747",
      "name": "Wikidata: Lindsay de Sausmarez",
      "url": "https://www.wikidata.org/wiki/Q135400747",
      "sourceType": "wikidata",
      "publisher": "Wikidata",
      "language": "en",
      "license": "CC0-1.0",
      "retrievedAt": "2026-10-20T19:54:39Z",
      "archivedUrl": null,
      "notes": "P6 on Guernsey (Q25230), rank ontology#preferred, start 2025-07-01"
    }
  ],
  "officeholders": [
    {
      "id": "gg-head-of-state-1",
      "jurisdictionCode": "GG",
      "subdivisionCode": null,
      "administrativeArea": null,
      "office": {
        "id": "Q9134365",
        "title": "Monarch of the United Kingdom",
        "localTitle": null,
        "level": "national",
        "selectionMethod": "unknown",
        "termStart": "2022-09-08",
        "termEnd": null
      },
      "person": {
        "name": "Charles III",
        "localName": null,
        "languageCodes": []
      },
      "contacts": [],
      "sourceIds": [
        "gg-wikidata-q43274"
      ],
      "verification": {
        "status": "unverified",
        "checkedAt": "2026-10-20T19:54:39Z",
        "verifiedAt": null,
        "verifiedBy": null,
        "method": null,
        "evidenceSourceIds": [
          "gg-wikidata-q43274"
        ],
        "reviewBy": null,
        "notes": "From Wikidata. Needs an official government or parliament page and a second-person check before it can be verified."
      }
    },
    {
      "id": "gg-head-of-government-1",
      "jurisdictionCode": "GG",
      "subdivisionCode": null,
      "administrativeArea": null,
      "office": {
        "id": "Q3245461",
        "title": "Chief Minister of Guernsey",
        "localTitle": null,
        "level": "national",
        "selectionMethod": "unknown",
        "termStart": "2025-07-01",
        "termEnd": null
      },
      "person": {
        "name": "Lindsay de Sausmarez",
        "localName": null,
        "languageCodes": []
      },
      "contacts": [],
      "sourceIds": [
        "gg-wikidata-q135400747"
      ],
      "verification": {
        "status": "unverified",
        "checkedAt": "2026-10-20T19:54:39Z",
        "verifiedAt": null,
        "verifiedBy": null,
        "method": null,
        "evidenceSourceIds": [
          "gg-wikidata-q135400747"
        ],
        "reviewBy": null,
        "notes": "From Wikidata. Needs an official government or parliament page and a second-person check before it can be verified."
      }
    }
  ]
}
