{
  "schemaVersion": 2,
  "jurisdictionCode": "SM",
  "generatedAt": "2026-10-20T19:54:39Z",
  "sources": [
    {
      "id": "sm-wikidata-q1353628",
      "name": "Wikidata: Italo Righi",
      "url": "https://www.wikidata.org/wiki/Q1353628",
      "sourceType": "wikidata",
      "publisher": "Wikidata",
      "language": "en",
      "license": "CC0-1.0",
      "retrievedAt": "2026-10-20T19:54:39Z",
      "archivedUrl": null,
      "notes": "P35 on San Marino (Q238), rank ontology#preferred, start 2025-04-01"
    },
    {
      "id": "sm-wikidata-q57546",
      "name": "Wikidata: Denise Bronzetti",
      "url": "https://www.wikidata.org/wiki/Q57546",
      "sourceType": "wikidata",
      "publisher": "Wikidata",
      "language": "en",
      "license": "CC0-1.0",
      "retrievedAt": "2026-10-20T19:54:39Z",
      "archivedUrl": null,
      "notes": "P35 on San Marino (Q238), rank ontology#preferred, start 2025-04-01"
    }
  ],
  "officeholders": [
    {
      "id": "sm-head-of-state-1",
      "jurisdictionCode": "SM",
      "subdivisionCode": null,
      "administrativeArea": null,
      "office": {
        "id": "Q258045",
        "title": "Captain Regent of San Marino",
        "localTitle": null,
        "level": "national",
        "selectionMethod": "unknown",
        "termStart": "2025-04-01",
        "termEnd": null
      },
      "person": {
        "name": "Italo Righi",
        "localName": null,
        "languageCodes": []
      },
      "contacts": [],
      "sourceIds": [
        "sm-wikidata-q1353628"
      ],
      "verification": {
        "status": "unverified",
        "checkedAt": "2026-10-20T19:54:39Z",
        "verifiedAt": null,
        "verifiedBy": null,
        "method": null,
        "evidenceSourceIds": [
          "sm-wikidata-q1353628"
        ],
        "reviewBy": null,
        "notes": "From Wikidata. Needs an official government or parliament page and a second-person check before it can be verified."
      }
    },
    {
      "id": "sm-head-of-state-2",
      "jurisdictionCode": "SM",
      "subdivisionCode": null,
      "administrativeArea": null,
      "office": {
        "id": "Q258045",
        "title": "Captain Regent of San Marino",
        "localTitle": null,
        "level": "national",
        "selectionMethod": "unknown",
        "termStart": "2025-04-01",
        "termEnd": null
      },
      "person": {
        "name": "Denise Bronzetti",
        "localName": null,
        "languageCodes": []
      },
      "contacts": [],
      "sourceIds": [
        "sm-wikidata-q57546"
      ],
      "verification": {
        "status": "unverified",
        "checkedAt": "2026-10-20T19:54:39Z",
        "verifiedAt": null,
        "verifiedBy": null,
        "method": null,
        "evidenceSourceIds": [
          "sm-wikidata-q57546"
        ],
        "reviewBy": null,
        "notes": "From Wikidata. Needs an official government or parliament page and a second-person check before it can be verified."
      }
    }
  ]
}
