{
  "schemaVersion": 2,
  "jurisdictionCode": "MA",
  "generatedAt": "2026-10-20T19:54:39Z",
  "sources": [
    {
      "id": "ma-wikidata-q57553",
      "name": "Wikidata: Mohammed VI of Morocco",
      "url": "https://www.wikidata.org/wiki/Q57553",
      "sourceType": "wikidata",
      "publisher": "Wikidata",
      "language": "en",
      "license": "CC0-1.0",
      "retrievedAt": "2026-10-20T19:54:39Z",
      "archivedUrl": null,
      "notes": "P35 on Morocco (Q1028), rank ontology#normal, start 1999-07-23"
    },
    {
      "id": "ma-wikidata-q3067221",
      "name": "Wikidata: Fatima Ezzahra El Mansouri",
      "url": "https://www.wikidata.org/wiki/Q3067221",
      "sourceType": "wikidata",
      "publisher": "Wikidata",
      "language": "en",
      "license": "CC0-1.0",
      "retrievedAt": "2026-10-20T19:54:39Z",
      "archivedUrl": null,
      "notes": "P6 on Morocco (Q1028), rank ontology#normal, start 2026-09-29"
    }
  ],
  "officeholders": [
    {
      "id": "ma-head-of-state-1",
      "jurisdictionCode": "MA",
      "subdivisionCode": null,
      "administrativeArea": null,
      "office": {
        "id": "Q14566719",
        "title": "King of Morocco",
        "localTitle": null,
        "level": "national",
        "selectionMethod": "unknown",
        "termStart": "1999-07-23",
        "termEnd": null
      },
      "person": {
        "name": "Mohammed VI of Morocco",
        "localName": null,
        "languageCodes": []
      },
      "contacts": [],
      "sourceIds": [
        "ma-wikidata-q57553"
      ],
      "verification": {
        "status": "unverified",
        "checkedAt": "2026-10-20T19:54:39Z",
        "verifiedAt": null,
        "verifiedBy": null,
        "method": null,
        "evidenceSourceIds": [
          "ma-wikidata-q57553"
        ],
        "reviewBy": null,
        "notes": "From Wikidata. Needs an official government or parliament page and a second-person check before it can be verified."
      }
    },
    {
      "id": "ma-head-of-government-1",
      "jurisdictionCode": "MA",
      "subdivisionCode": null,
      "administrativeArea": null,
      "office": {
        "id": "Q19842743",
        "title": "Prime Minister of Morocco",
        "localTitle": null,
        "level": "national",
        "selectionMethod": "unknown",
        "termStart": "2026-09-29",
        "termEnd": null
      },
      "person": {
        "name": "Fatima Ezzahra El Mansouri",
        "localName": null,
        "languageCodes": []
      },
      "contacts": [],
      "sourceIds": [
        "ma-wikidata-q3067221"
      ],
      "verification": {
        "status": "unverified",
        "checkedAt": "2026-10-20T19:54:39Z",
        "verifiedAt": null,
        "verifiedBy": null,
        "method": null,
        "evidenceSourceIds": [
          "ma-wikidata-q3067221"
        ],
        "reviewBy": null,
        "notes": "From Wikidata. Needs an official government or parliament page and a second-person check before it can be verified."
      }
    }
  ]
}
